J***m,star5,外观材质：直边给人一种规矩的感觉屏幕效果：2360x1640的屏幕显示很清晰运行速度：配上首发A14芯片，很多专业软件使用起来都非常顺手！轻薄程度：极其轻薄这段时间使用下来，感觉可以胜任很多笔记本可以的办公需要！
d***y,star5,说实话，家里也有一款iPad已经有五六年了，但一看到这款就忍不住下手了～天蓝色是我的最爱，屏幕超级清晰，画质很高。上下各有两个喇叭，声音也很大，侧面还有一个供pencil充电的磁吸。最值得赞的是，接口也不是以前苹果惯用的lighting接口，用的USB-C接口，就是现在通用的TYPE-C的接口，至少以后也不用带几个充电器了。总而言之，爱，很爱，超级爱！
j***K,star3,一般般了嘛呢嘛呢嘛呢
南***往,star5,非常好用的平板，没有home键更简洁。type-c的数据线充电口更方便，以后出差旅行只需携带一type c线全部完美解决屏幕效果：非常清晰运行速度：非常快，感觉不到卡顿。轻薄程度：非常的轻薄，安上保护套以后感觉机器重了点（保护套有点重了）。外观材质：上了保护套了设计的再好也感觉不出来了（舍不得裸奔）但愿不会掉漆。
g***o,star5,此款做工精细，屏幕清晰，处理图像，视频，办公操作毫无压力，对于普通操作运行速度流畅，立体音效有质感，非常适合学习和看电视。
好***旺,star5,京东自营商品值得信赖，下单速度快，质量好，全新未拆封，配件齐全，收到货后检测并激活，质量没的说，设备非常快，比老平板有了质的飞跃。屏幕反应很快清晰鲜艳，电池非常耐用，做笔记和日常娱乐都非常棒??，活动价格用了优惠券还便宜了不少钱，真是太实惠了。附赠的耳机非常好，蓝牙链接，既方便音质又好。
A***信,star5,外观材质：金属质感，手感很棒，一如既往滴舒服屏幕效果：屏幕虽然没有120Hz高刷，但是也蛮可以的，看着也很舒服，手感也不错运行速度：运行速度流畅，无卡顿现象轻薄程度：很薄，很小巧，很强
灰***郎,star5,真好啊 这个iPadAir2020款的 蓝色真漂亮 爱了爱了运行速度快 秒杀一切 玩游戏 看电影 追剧 学习网课必备啊 速度入手吧 给小朋友学习用哈哈 别人回头涨价了 真好 牛气冲天?????????? 感谢京东 让我第二天就收到了货了 辛苦了！2??0??2??1?????
天***人,star5,学习神器，256的空间足够挺好几年，配上笔可以吸附在旁边充电，记笔记啥的很方便。蓝色自认为是最好看的颜色，直男审美。休闲时，追剧，看直播，刷抖音，看漫画体验都不错。总体物有所值。
j***2,star5,苹果的这款平板电脑，10.9英寸视网膜全面屏显示高清细腻，操作系统非常顺滑流畅， A14芯片功能强大，手写笔套装超级实用，物流送货速度快，小哥服务态度很好，相信京东，好评！
j***2,star5,家里有一台iPad mini2已经七八年了，给孩子上个网课卡的不行，还是32g的，内存很容易就满了，刚好有活动，就换了一个大尺寸的iPad air4，选了个最大内存，256g的一步到位，再也不担心内存满的问题了，物流发货很快，第二天就到了，运行很流畅，a14仿生芯片真的很厉害。
蓝***鸿,star5,从13年的第一代ipad mini到现在已经很吃力了，很多app也不能下载了，必须换一台了。现在ipad Air性能简直值的飞跃，一分钱一分货，分屏功能，手写功能，超级实用，电池容量也大。不管游戏，办公还是学习，值得推荐！
瑞***n,star5,哇这平板颜值是真的不错呀，拿到手的瞬间真的是感觉买的超级划算，给人一种高大上的感觉，无论是外观还是内存都让我很满意，是一次很愉快的购物。外观材质：很棒屏幕效果：不错运行速度：非常快轻薄程度：薄
邹***邹,star5,使用感受非常不错，价格也还OK，用来学习比较便捷，比笔记本要轻很多，无纸化学习我来啦！但是容易玩游戏上瘾，哈哈，需要锻炼自己的自控力
c***3,star5,快递包装完好无损，送货速度很快！现在家里的电子产品全是在京东购买，质量有保证售后服务更好！这个平板种草很久了收到后没让我失望，外观大气上档次蓝色的非常漂亮。屏幕显示细腻，运行速度很快！每个方面都很满意！
j***X,star5,品质保证，质量保证。京东商城购平板就是放心，原装未拆封，配件齐全原装正品保证。做工精细无瑕疵。开机灵敏无异常，程序游戏无卡顿延迟现象发生。屏幕无亮点，无漏光。轻薄。一句话放心的网购。愉快的网购，没有出现有些评论里的那些问题。物流超快。五星好评，京东商城购物就是放心五星好评！
卜***塔,star5,很喜欢苹果的产品，买来玩游戏的，颜值高，质量超棒??，拍照也很清晰，不喜欢自带美颜，觉得太假，苹果拍得照片很自然很好！物流也很快！
娇***晨,star5,太空灰很漂亮，很高大上，开始纠结绿色和蓝色，可是没有抢到，最后买了灰色，收到货以后很是惊喜，包装很好，就是稍微膜上有点灰，不影响，速速很快，屏幕也是很清楚，好评
j***v,star5,不错，很好的平板电脑。我所有的平板电脑一直用苹果品牌。用很多年一直如当初流畅。外观材质：很好看，有当年4s在手的感觉。拿起它有点想把11换十二了。屏幕效果：显示效果也非常不错。运行速度：速度非常流畅，加上14 处理器，应该可以坚持几年了。因为我运行的软件要求有点高。
d***磊,star5,屏幕效果：显示效果细腻，颜色真实运行速度：运行流畅很不错轻薄程度：轻薄，携带方便外观材质：外观好看，值得推荐
只***哥,star5,三千七入手ipadair4 而且是插卡版的，非常值，也特别香，迷你系列这种配置得五千，而且air屏幕也够大，基本需求都可以满足
南***东,star5,喜欢全面屏，喜欢天蓝色，喜欢金属边框，好爱，对于不需要经常拿着走来走去的人很合适，追剧很舒服，声音也可以！618买的价格也很合适！
t***o,star5,外观材质：屏幕外观很完美，没有磨损痕迹，非常好屏幕效果：屏幕色彩艳丽，没有坏点，看4k高清视频非常棒，拿到手之后看了个通宵，非常过瘾运行速度：机器运行速度快，打开应用速度快，玩了一会游戏，机器发热，不卡顿。打开多个应用在后台运行流畅轻薄程度：屏幕尺寸大小合适，方便携带
今***子,star5,货己到手。手感很好，清晰度很高，看视频非常流畅，很清晰，没有卡顿。小孩子在上面学习汉字也是非常的清楚的。内存够大，不担心数据放不下了。。价格比较划算。从十月一号等到29号秒杀
l***0,star5,挺好，用几天再来追评，目前看着都不错！主要是价格非常合适！
j***4,star5,这是时隔多年后购买的第三台iPad，品质、手感和性能一如既往的优秀。这个蓝颜色很喜欢，整机屏幕和外壳质感都不错，全面屏看着就是开阔，轻薄握感舒适，四个扬声器产生了极强的环绕声效果，总之一切都很满意。
j***7,star5,上个月2月14日，情人节买的，买给老婆的节日礼物，老婆说，收到的礼物很开心，很喜欢，很惊喜！！！日常64G用来追剧妥妥滴！颜值超高，很好！
夏***妹,star5,性价比超高的一款，外观非常漂亮，超薄的一款。仿生芯片处理视频、图像、办公文字毫无压力，足够使用，全面屏，运行速度快，屏幕分辨率高，滑快流畅自然，待机时间长，续航给力，操作简易，触控ID，人性化设计，前后摄像头设置，，买的是天空蓝的，哇洋气的不要不要的，总之，不论是外观颜色性价比还是功能以及其他的机器所包涵的功能，都是超一流的，我的上一个Apple ipad可以光荣下岗了
F***猩,star5,信任京东，物流快，售后服务好！物美价廉。电子产品和家用电器都从京东买。品质有保障！好??非常好??非常满意?会推荐朋友！京东加油！电扇也是京东买的，也很棒??
范***2,star5,外观材质：买的金色的，很漂亮，手感丝滑，其实所有的颜色都好看。屏幕效果：很清晰运行速度：很快，看视频就知道了轻薄程度：轻，屏幕大，看着很舒服其他特色：希望用久一点，上一个用了8年不能升级才换的。
j***郭,star5,非常漂亮的天蓝色，很轻薄，手感很好，赶快安排上保护套，这样用起来会比较有安全感一些。屏幕效果清晰，拍照效果不错，听音乐?低音效果杠杠滴，很满意的一次购物。
j***f,star5,"14年买的ipad2,内存是16G。现在还可以正常使用。但内存不足，配置落后，不能满足现在需求。拿在手里很沉，速度慢，经常卡，时有黑屏，今年给自己的新年礼物就是ipad4air。拿在手里很轻薄，颜色也很高大尚，屏幕清晰，速度快，待机时间长，足以满足**常需求。京东物流一贯给力。点赞！"
黑***框,star5,外观材质：不用说了，苹果风，简洁，大方，没有了home键，不开机的时候看着像全面屏的，开机就会有条大黑边了。屏幕效果：一如既往的出色，虽然没有pro的120HZ，但是日常用也感觉不出来。运行速度：比家里8年前的ipad2快了太多?，苹果的平板一直是最具性价比的，也十分耐用。轻薄程度：真的很轻，很薄，确实符合air的特色。
旗***师,star5,比较了好几家购物网站，在京东这里找到的是最便宜的，还可以开增票。京东购物有保障，送货速度也是杠杠的。机子拿到后爱不释手，玫瑰金超好看，使用起来也很流畅，画面、声音都不错，手感好，又薄又轻，配合苹果笔写字，上课记笔记复习都很好用。
j***0,star5,母亲节想给妈妈买个平板，硬等到618活动，降了几百元，还算可以。蓝色挺好看的，妈妈拿到很喜欢。希望能用久一点。
水***溪,star5,孩子各种网课，家里的老iPad速度有些跟不上，果断换新又赶上大促，原本想买蓝色，翻看买家秀的功夫蓝色断货了，选了深灰色，本想着反正要用保护套什么颜色无所谓了，结果收到后有惊喜，深灰色很耐看有质感不忍心掩盖它低调的美，所以买个清水壳套上啦，真香，突然发现近几年的苹果产品都在京东买的，nice
止***9,star5,在64G和128G之间犹豫了好久，考虑到大概要用好多年，最终咬牙一步到位选了128G。物流非常快，包装完好，开机体验也棒棒的！一分价钱一分货，pad选择苹果绝对不后悔，性能太棒了！第一时间配了保护外壳、贴了钢化膜，非常满意非常喜欢?
小***西,star5,平板很棒，很喜欢，第一次用苹果系统，还在摸索中。不过用腾讯视频看的时候，他屏幕上面都是黑的，屏幕最下面也是黑的。希望苹果公司能够跟腾讯视频合作，把这个问题给解决了，方便用户体验。
u***i,star5,外观材质:深灰色是我喜欢的金属手感嘻嘻电脑性能:主要用来学习偶尔辅助mbp处理-下图像或者***good good因为家里有一台mbp，所以对平板电脑的配置要求就没有很苛刻，主要是用来辅助自己上网课的时候可以无纸化学习，搭配二代笔效率非常高。有人 说相比pro，air 屏幕刷新率没那么高，但我觉得用下来 不会眼睛不舒服(本人 眼敏感)也不会觉得屏幕卡顿之 类的!是一款很不错的学习生产工具啦!笔和平板 电脑是一起买的京东1天到上海，对比了蛮多家的评论、价 格和套餐内容最后还是在这里买了，一-到手就爱 思验了!未激活充电次数0电池健康序列号也没问题机子生产日期也算新鲜hhh安全下车uu们可以冲了!
冰****,star5,这款机器真的非常的好用，外观好看颜值高，包装精致特别的厚实，机器运行速度特别的快，学习游戏都没有任何的压力，家里的弟弟想跟我换
月***鲸,star5,外观材质：绿色很好看 很轻薄 质感很好屏幕效果：清晰有质感运行速度：新机运行不会有问题吧轻薄程度：很轻薄其他特色：绿色很好看 很有质感  拍照不错 反应也快  可以入手 仅供参考
j***e,star5,平板到手非常的轻，这是第一感受，然后好像不支持5g网络，连了家里的5g网就自动关机，吓我一跳，还好咨询了客服，解决了这个问题。外观材质：颜色是我喜欢的灰色，套上亚克力的透明壳子哈哈哈哈
y***7,star5,外观材质：盒子被挤压过，还好在背面，没伤到机子本身。粉色的外观很时尚，屏幕保护完好。轻薄程度：机子整体非常薄，手感舒服，大小合适，用起来很顺手。其他特色：整体非常不错，运行流畅。
u***3,star5,手感好，颜值高！运行速度快，指纹识别解锁功能也很棒！外观材质：挑了蓝色的，颜值高。屏幕效果：清晰 明亮运行速度：快 很快轻薄程度：轻薄、比前几代都轻，直角边拿着很稳
y***i,star5,说实话这个ipad air4刚购没多久的，苹果的平板反应也超快，大小合适，给孩子上网课用的，屏幕够大，很清晰，第一次用苹果pad，开始不会玩，现在学会了，真的很好用，下载app也挺快的。孩子更爱学习了。画质清晰，开始不会安装，客服耐心解答，赞一个。会一直关注的。终于等到了苹果产品线的官方活动，ipad air3与ipad air 第一代的进度真的巨大，无论速度还是显示效果都是一级棒。加上京东给力的活动，12期免息分期，这次采购太超值了。给孩子上网课，工具很重要，孩子用来上网课用，特意买了个大屏幕的，很满意，比原来米你的好用多了。同时买的套套还没收到，现在用着有些滑手，十分轻薄，外观也不错，不过回头套上套都一个样子，无所谓了，运行速度现在也很快，满意，总体好评。对了，京东plus买的这款，比其他颜色的价格低四百。值得购买。现在这个更超薄，轻便 ，屏幕分辨率也很好?? 总之非常满意。
凌***1,star5,买的天蓝色的，高级感绝了，特别喜欢，铝合金边框，尽显苹果系列特色。屏幕效果：10.9英寸全面屏，分辨率高，具备全面性能，镜面效果*真，令您赏心悦目。运行速度：A14仿生芯片流畅度高，孩子学习，观看电影，浏览新闻，游戏娱乐，功能强大，尽显流畅本色。轻薄程度：拿着顺手，放桌美观，触感好、很轻薄，深灰色、大众化，镜贴膜、体验好。其他特色：WiFi版，操作简易；触控ID，人性化的设计；摄像头前后设置，秉持一贯风格。店铺服务也特别好。
c***6,star5,用了一个多月了，感觉很好。屏幕是窄边的，屏幕比较大。运行速度快，目前使用情况良好。期待再评外观材质：颜色偏蓝灰一些。屏幕效果：清晰，一直没有贴膜。运行速度：你以前的比快很多。
韩***8,star5,物超所值，质量特别好，比起以前的款式好看很多，天蓝色真的好看，特别薄，看电视，看电影，拍照，玩游戏，等等，一切都好。物流也很快，满意满意爱了爱了
x***4,star5,苹果ipad的质量没话说，一买来办公、游戏、学习、看欧洲杯各种流畅。air的质感也很好，天蓝色没有传统天蓝色那么亮，但是很时尚，618打算买键盘和鼠标，秒变笔记本。
j***B,star5,下单时是采购中的状态，没想到转天就收到了，查了序列号，没发现问题，给孩子上网课用，操作顺畅，画质音质都很清晰，价格比618当天还划算，包上喜欢的粉色壳子，开始纵享丝滑。
臭***森,star5,距离上一次买平板是**年前了，是一台mini2。现在小孩都**岁了换一个让孩子上上网课之类的自己也可以追剧一举两得。趁618优惠力度大就入手啦。到手之后发现比想象中大很多啊！比mini2大了一大圈要慢慢适应了。平板做工精细简约时尚，根mini比起来没有额头下巴。解锁很方便就在电源按钮上。屏幕靓丽显示效果很真实不会觉得眼睛不舒服。分辨率嘛中规中矩，毕竟我这双眼睛用过2k的AMOLED屏的。属于比较挑剔的啦
j***a,star5,外观材质：外观精美，手感舒适屏幕效果：屏幕清晰运行速度：一如既往的快轻薄程度：超薄机身，携带方便
佘***艳,star5,大m反映超快，看片神器，手绘画，下载个绘画软件，美滋滋～身体体验也不错，声音体验非常棒：四个听筒，立体声！棒棒的！
王***4,star5,外观材质：很轻薄的外观，也很好看，新款iPad和iPhone12设计外观一样，都是采用直角的设计，手感很好，设计比上一代有了很大的变化，很喜欢！屏幕效果：屏幕效果很棒，分辨率很高，比我手机屏幕要好很多，看电影也很爽，非常棒的屏幕！运行速度：运行很快，A14处理器很棒！
球***戏,star5,外观材质：铝合金属外壳，很，轻薄拿在手上很舒服屏幕效果：屏幕显示非常清晰，双扬声器观看视频效果很棒运行速度：A14运行速度没得说，ipad使用寿命很久，之前是air2用了好久轻薄程度：非常轻薄，直角边框全面屏的设计，还可以支持二代笔，不用像一带笔那样了
尧***下,star5,iPad air4非常的好用，轻薄，蓝色也很好看。配上二代笔，写字非常的爽滑，特别是在PPT上做笔记很好用，生产力生产力确实是生产力，看腾讯视频和爱奇艺也很好，手机上只能看1080P在这上面可以用真彩看。
仗***塵,star5,外观材质：合金装备，手感特好。屏幕效果：特别清晰，视觉冲击。运行速度：4G运行，64g存储。轻薄程度：一体后盖感，特别好看，系统生态特别好，简洁明了，而且价格还是比较实惠.不到四千。
沐***屋,star5,天蓝色我的最爱，百看不厌高级感，10.9全面屏，分辨率高，画面清晰，全新视觉体验，轻薄便于携带，运行速度极快，双扬声器音质不错，京东平台买的放心！
x***4,star5,心心念念的宝贝平板ipad终于到啦！ 本来录了个开箱视频怕有问题 哈哈哈 完全不存在 没有任何问题 开心  机子很薄 很舒服 用起来也很流畅 喜欢！
j***r,star5,宝贝收到，包装完好无损，物流很快，大小适中，手感不错舒适，速度也很快，女儿喜欢，以后追剧更方便了，京东购物有安全感，好评！
斑***丁,star5,在iPad2021款和ari4款纠结，还是选择了这款，外观设计真的很好看，用来用一些文件和看视频64g完全够用！
真***哈,star5,绿色超级可！！！买来是打算画画的，笔也是斥巨资狠心买的激活之后一顿操作很流畅，电量开机的时候是89%，笔一吸就行了，而且很有重量，很有感觉外观材质：很有质感屏幕效果：清晰运行速度：流畅轻薄程度：很好
飞***云,star5,这款平板太优秀了，性价比很高，苹果产品还是这款直角边的设计经典，首先屏幕绝对高端，比上一代屏幕进步很大，外壳材料是铝镁合金，成本很高，两侧喇叭清晰有力，效果不错，20W快充速度惊人，比想象中要快，电池电量比较耐用，特别是这个USB-C接口，属于高速接口，可以轻松方便连接许多设备，软件生态就不用说了，多年积累，用着舒服，属于目前平板电脑的天花板，完全值回票价。
一***烯,star5,外观材质：跟官网的没差别，都是一个样子的，后壳是金属的屏幕效果：屏幕是全贴合的，用着也很好运行速度：运行速度这一块没话说，用苹果用的就是它的运行速度
栀***_,star5,对比了很久才买的 很漂亮 颜色很正 好玩 大 打游戏也舒适 立体影音 追剧超爽的 跟手机搭配也很好的 买前生产力 买后爱奇艺yyds
e***o,star5,性价比很不错，以旧换新的方式很好，不用留着电子垃圾虽然是两年前的机器，但是性能还是挺不错的！
J***f,star5,外观材质：正面IPS玻璃屏，背面天蓝色铝材质，轻薄，手感好；屏幕效果：屏幕分辨率高，非常清晰，触摸灵敏，太好用了；运行速度：速度刷刷的，反应很快；轻薄程度：很薄，方便其他特色：物流快捷
小***黄,star5,外观材质：手感拿起来很舒服，用来追剧在合适不过了屏幕效果：追剧画画非常棒运行速度：苹果系统众所周知很流畅，但是有时候切换软件会卡一下轻薄程度：拿起来很轻，方便携带其他特色：对比了其他很久，在自己经济条件允许下选择了这款，画画打游戏追剧都很适合
帷***爸,star5,质量杠杠的，反应速度快，给小孩上网课用的64G完全够用啦。。小孩子非常的喜欢，不卡。。。。。。。。。。。。。。。。。。，，，，，
j***c,star5,一直种草这个颜色，Ipad4真是轻薄啊，屏幕分辨率清晰，触感是一如既往的操作流畅，孩子上网课绝对够用了，256内存也够用一阵子的了
和***9,star5,外观材质：材质做工非常细腻，边框包裹整齐，按键手感舒适！屏幕效果：屏幕分辨率高，画面清晰，屏幕尺寸很合适平时学习 、看电影等运行速度：开机速度超快，操控性能超强，屏幕上操作手感非常棒！轻薄程度：重量和一本普通书本差不多，轻薄库和苹果4的厚度差不多，拿在手里很方便，读书、学习也是很方便！
买***买,star5,发货快，京东服务没得说，虽然没拆封，苹果产品也是毋庸置疑的强悍，非常好，还没开机，先等等看，总之，对苹果的东西还算放心的，现在还用着12年买的ipad3，虽然运行起来卡顿，但看视频和电视直播一点都不卡，已经留给老人看电视
慧***辣,star5,想自己学习购买，买了256 蓝色非常耐看高大上??整好遇到学生优惠很合适哈哈购买了保护套非常奶思喜欢 全面屏视野很棒，拿到快递没想到这么轻哈哈哈哈哈迫不及待的拆箱查看比较轻便外机是做的立体环绕高级感满满，下载了学习软件整理桌面，分屏，听歌立体环绕哇塞了绝绝子，总之独特，爱学习和画画的乖乖可以入手哦，哈哈开启我的分期体验 加油??送给爱奇艺?生产力的自己耶耶?
m***3,star5,这套平板电脑，孩子想要好长时间了!一直没时间买!等到搞活动时买了。非常合适，里面的功能非常丰富。孩子非常喜欢。屏幕非常清晰。
z***n,star5,刚拿到宝贝，颜色外观都是我喜欢的，打开后，界面简洁，色彩饱和度很高，速度也很快，配的笔也很好用。总之，这次购物还是比较满意的
夜***兔,star5,很棒，和我的18款pro差不多，边框厚一点点但是感知不大。指纹识别结合了锁屏按钮，非常舒服。屏幕素质也很不错，系统也很流畅，非常满意
R***绿,star5,外观材质：触感真好、膜还没有到。所以摸的屏幕上都是指纹。凸^-^凸。运行速度：因为之前是air2代。所以明显速度快了很多、不能对比。轻薄程度：很轻很薄、哈开心。
k***C,star5,上手感觉非常好，运行速度很快，不愧是苹果新air产品，非常喜欢。外观非常好看，也有指纹解锁，解锁速度非常快，也很实用，现在每天到家都拿着玩游戏，真爽。家里人也可以在上面玩玩游戏，家里乐趣增加了不少。
天***人,star5,很不错哦，屏幕够大，运行流畅，孩子上网课用，只下载了**和**会议，64g的目前够用。电池也够大。很薄，不算很轻。天津隔天就到了，京东物流很快。
h***聪,star5,"外观材质：我选择了灰色,裸机确实好看,优雅轻薄;有一点要注意 iPadAir 4没有配备耳机插孔了,但搭配AirPods 也不错。屏幕效果：色彩表现效果非常好,玩游戏也很流畅其他特色：续航试了一下十个小时没有问题，200万像素的广角摄像头和700万像素的前置摄像头,拍摄的照片色彩准确度很高。"
j***5,star5,外观材质：棒棒哒，好看?呢屏幕效果：10.9够用，打游戏的话还是太大了，蛤蛤蛤，看课程是很不戳的运行速度：流畅度可以，拿来考研学习的，64G够用了轻薄程度：还行呢，不会太厚辣
M***货,star5,多年后再买pad，这款的确性价比超高，蜂窝在关键时候能派上用场，第一次体验A+，也不知道用不用得上，但价格还是很好的，还配了pencil，体验中
王***敌,star5,第4代iPad Air，全面屏平板，支持快充，比前几代质的飞跃，屏幕够大，屏幕显示细腻，轻松快速的登陆支付。USB C接口，A14仿生芯片，运行速度超快，丝丝滑滑，观赏影片非常养眼，不戴套，很轻薄，以旧换新，价格也还是偏贵。
t***0,star5,平板电脑里ipad绝对是大哥的地位，这代的ipad air是王者，孩子看视频、识字用日常使用性能过剩，用5年绝对没问题。另外要说的是：绿色真的很养眼！
