白***丶,star5,京东自营的送货速度很快，下单后，半天就送到。芯片一样，而且还赶上了活动，性价比真的超高！外形外观：外观轻薄，拿在手里很舒服。运行速度：运行速度很快。手机还行。用了一个多星期感觉蛮好的，轻薄躺着刷剧一点都不累，续航也不错充满电能用七八个小时，拍夜景比上代强了，用起来也很顺畅丝滑，一点都不卡顿而且触感也非常好。
虎***6,star5,粉色颜值担当，真的非常nice。从6s转换过来的，玩游戏刷视频一天下来还有30%电，手感不错，适合中度使用，关键尺寸不臃肿，放口袋方便。
7***强,star5,手机性能： 拍照清晰 运行畅快 续航很好 外观大气上档次，非常漂亮，识别度高，屏幕显示效果丰 常清晰， 运行速度相当流畅，手机总体都不错哦！
龍***7,star5,外形外观：苹果的设计理念一直挺好的屏幕音效：屏幕素质很好，不刺眼拍照效果：拍照和视频都挺好运行速度：运行速度不错，流畅不卡顿
公***城,star5,外形外观：都不错，东西很好，618买的性价比可以，便宜了不少屏幕音效：次旗舰，东西不错，用着可以拍照效果：很不错，运行速度：速度快待机时间：蛮不错的其他特色：不错
j***5,star5,质量很好，款式和颜色也比较漂亮，女儿很喜欢，用着也不错，拍照效果很清晰，运行速度也比较快。很不错，推荐购买哦！
j***w,star5,高考后给买的手机，已经用了一段时间了，运行不卡顿，手机也不发烫。非常好用。拍照效果：清晰待机时间：充满电用一天没问题
u***p,star5,粉色这个颜色真心好看，而且都说这个型号性价比超高，果断下手买了。外形外观：好看屏幕音效：很好拍照效果：清晰运行速度：速度
j***m,star5,苹果超级快，超级好，超级好用，再等苹果15。又喜欢苹果。好喜欢好苹果，那速度很快，打游戏很快，接电话也很快，信号也不错。我买
非***8,star5,星光白的颜色，非常漂亮，永不过时的颜色，很喜欢，大爱，现在价格很实惠，还是喜欢苹果的流畅不卡机，拿手上这个重量可以，手感舒服，值了
j***T,star5,运行速度：虽然是苹果13手机，不过苹果的系统还是很不错的，用起来非常的流畅，很丝滑，没有卡顿的现象！待机时间：我觉得基本可以满足我一天的需求了
j***Z,star5,苹果这款手机外型很漂亮，音质也很好，拍出的照片颜色柔美，照片清晰度高，运行速速度很快一点都不卡。充电速度快，待机时间长。京东配送速度非常快。
h***T,star5,苹果手机很好用，外形好看，屏幕很好，非常的细腻，充电后可以用两三天，待机效果好，运行速度快，还可以打电话和发短信，功能很多。
小***吠,star5,快递很快，拍照也很清晰，显示效果还可以，很耐看的颜色，简洁的界面设计，手机非常高的安全系数，电池续航能力也很强，手机小方便携带，小巧，物超所值，值得购买
j***猫,star5,星光色第一眼看起来很单调，多看几眼觉得不会腻，很耐看。一如既往的简约稳定可靠优秀，拍视频拍照太好用了，比较清晰变焦过度的很流畅，这是实际使用明显强大的功能之一
雨***米,star5,这款手机的性能也非常强大。搭载了—颗高性能的处理器和大容量的内存，运行各种应用和游戏非常流畅。无论是多任务处理还是高负荷的应用，都能轻松应对。而且，它的电池续航能力也非常出众，充满电可以便用一整天。作为—名摄影爱好者，我对这款手机的摄像头也非常满意。配备了多个镜头，可以拍摄出高清．清晰的照片和视频。而且，智能相机功能非常出色，可以自动识别场并根据不同的拍摄需求进行谓整，拍摄效果更出色。
彤***n,star5,手机收到了，质量很好，618买的，价格实惠，包装严实没有破损，非常满意，送给妹妹高考后的礼物，很赞，妹妹很喜欢，音质很好，内存够用了，运行不错，拍照效果也可以，满足她的需求
A***虎,star5,苹果手机的外观外形设计非常的流畅，握在手里的手感也是超棒，屏幕显示效果很好，运行流畅，简洁大方的图标、桌面设置，这一代苹果手机的续航能力也是很能打的，非常满意的一次购物。
j***q,star5,从11换过来的，隔了2代，升级挺大的，A15的芯片很强大，运行速度蛮快的，拍照像素也可以，对比11的话，提升了很多，发热控制的也还不错，打游戏的时候。
陈***_,star5,外形外观：时尚时尚最时尚屏幕音效：挺好的，音效完美，听音乐有立体回音的拍照效果：很真实，像素很高！买了好几次了，京东的可以放心的～会回购的～
噜***咯,star5,1. “iPhone 14真的是一款非常棒的手机，它拥有令人惊叹的外观设计和出色的性能表现。我特别喜欢它的操作系统10s，它让我的手机使用体验非常流肠和舒适。”2. “我刚刚购买了iPhone 14，使用了一段时间后，感觉它的相机效果非常出色。尤其是在低光环境下，相机的表现让我非常惊喜。”3. “Phone 14的屏幕质量非常棒，无论是色彩表现还是清晰度都非常出色。而且，它的屏幕尺寸刚刚好，使用起来非常舒适。”
N***3,star5,到手了，太漂亮了。很好用。值得信赖，外形外观：好看大方拍照效果：原相机就很好，很好用。也不卡，真的还得是苹果
J***8,star5,果粉支持苹果，粉色很好看，软软糯糯，年纪大了就爱粉色了，之前手机都是黑色的，屏幕和之前的11一样大，只是外轮廓变直角了，换机无障碍很方便还会回购
H***C,star5,趁活动买的，4200感觉价格还行，用起来运行速度狠流畅，拿在手里大小也正好，屏幕分辨率看起来很舒服，拍照效果也很好，电池也很耐用，不玩游戏使用一天没问题。
j***A,star5,物流速度很快，收到就立马开起来用了，用了好几个星期，感觉很好，就是屏幕小了点，5G网络。上网速度快，手机也很快，满意
每***完,star5,已经二次购买苹果14了，这次买来送女朋友的，她使用的非常满意，开心得不得了，9年果粉来了。通信音质：信号还可以的，有一点点差吧，苹果信号也就那样。其他特色：我买了二部就是紫色的，非常的好看的，棒棒哒猕显示效果：120高刷，4800像素摄像头，15倍变焦相机。真的非常给力的。
天***1,star5,性价比很高，是一款令人惊艳的智能手机！色彩鲜艳，视觉效果出色。120Hz的刷新率带来流畅的操作体验。同时，无论是日常还是夜间拍摄，都能轻松捕捉精彩瞬间。除此之外，强大的续航能力、快速的充电速度以及稳定的系统运行，真是一款让人难以抗拒的卓越选择！
猫***3,star5,下自己的使用习價。有手机壳，游戏充毛线。手机的颜色来很有质感。拿到手感觉超级经薄，比我以前的手机薄了整去
夜***章,star5,商品评价:苹果13收到货了，迫不及待的打开包裹，映入眼帘的是非常精致的外观，很好看，符合我的审美，激活也很方便，导资料可以一键导入，真心喜欢ios的系统很流畅不卡顿，整体待机时间也不错，实力推荐的好手机！！！
