输***寞,star5,外观材质：做工精细 品质优良屏幕效果：精彩表现，色彩鲜艳。运行速度：飞速运转轻薄程度：很轻很薄。其他特色：天蓝色，干净清爽买回来就打开用了一用，感觉运行速度非常顺畅！孩子爱不释手！
闫***瑞,star5,买来听课用 价格实惠 物超所值 以旧换新 又有超值800的劵屏幕效果：很棒外观材质：越来越轻便了运行速度：相当快速轻薄程度：轻其他特色：显示细腻 差价补贴很到位 买到就是很开心
1***啊,star5,我觉得很好，我也没有用过apple产品，这是第一个，感觉不错，现在刚买很流畅也是真实的，国行正品一年的保修，刚拿到手的时候，机子好凉?，屏幕也不顺，因为我没贴膜还，现在玩了好几个小时，鼓捣鼓捣着，屏幕很滑溜就跟贴膜了一样，赶紧买个膜和保护套保护起来我的iPad，所有有的东西都在学习中，我是拿来学习的，怕64的不够，直接买了256的，虽然想尝试蓝色，结果那时候没货了，买的深空灰也不错，音质我不是专业的我觉得我够用，视频还没看，相机的话也可以，真实还原，笔记啥的，看好的软件要花钱还没买，再等等，就先酱！
j***j,star5,屏幕清晰，运行速度快，包装没有损坏，京东物流超赞，配送速度超快，上午下单，下午5点多就到了，宝贝没有任何问题，很棒屏幕效果：很清晰运行速度：很快轻薄程度：有重量
m***h,star5,外观材质：非常好屏幕效果：非常亮运行速度：非常快轻薄程度：很薄
纸***双,star5,外观材质：外观不错，方方正正，我比较喜欢这样的。屏幕效果：屏幕清晰护眼。运行速度：运行速度快，流畅。轻薄程度：特别轻薄，用起来手感特别好。其他特色：平板的喇叭比较好，音质清晰。
沁***香,star5,外观材质：轻便舒适屏幕效果：视网膜屏幕运行速度：超快、兼容性强轻薄程度：超薄我们之前用的是二代苹果。但是系统升级以后很多软件，运行速度慢。不兼容。换了四代以后确实屏幕更加好！并且很多软件运行和下载的速度非常快。给孩子上网课用。另外就是用的爱回收服务。算上补贴，一共便宜了750元，非常划算，比实体店划算。
v***h,star5,特别棒，颜色漂亮，质感拉满。屏幕清晰，还支持2代笔，不需要iPad pro那么高性能，用Air日常看视频、写写笔记、玩点挂机游戏完全够了。强烈建议iPad买能插卡上网的版本，能和不能随时随地上网基本就是两个产品。
u***e,star3,?下单第二天居然搞优惠活动便宜300多
-***e,star5,苹果的质量还真的是可以的 这个ipad 4比8年前在的ipad2好很多呀 不过价格上也是差不太多的 这个比较清晰 拍照 流畅度也不错 上一个ipad用了8年了 还是很流畅的 但愿这个也能用这么久。
h***a,star5,外观材质：壳是磨砂的，手感很好。屏幕效果：很亮，屏幕很灵敏。运行速度：很快，下载东西也很快。轻薄程度：很轻，拿着很方便。其他特色：功能很多，新手教程也很全，以前没用过Apple的也可以直接入手。
V***o,star5,ipad air4 真香系列，首先就是颜值太高了，毕竟我是颜控嘛，绿色清新高雅！然后就要感叹一下，现在的ipad真的从最初的娱乐工具进化为生产力工具，能做的事情太多了，搭配pencil完成随手写，做笔记，画画，无所不能，新功能慢慢发掘！现在的学生也太幸福了吧，真正完全实现无纸化学习，上课下课一个平板就搞定了，大大提高了效率。真的是既可爱奇艺，也可生产力！ 而且air比Pro的性价比更高，Touch ID我觉得也很方便，最重要的是颜值足够高！
d***e,star5,外观材质：和iPad4比果然不是一个时代的产物。屏幕效果：清晰显示细腻。运行速度：A14配上iPad的散热没毛病。轻薄程度：非常轻薄，拿着很舒服。其他特色：蓝色好看。超级喜欢。
j***f,star5,这是给媳妇买的的新年礼物 媳妇要上网课 视频效果很棒的 非常清晰 机身也很薄 只是比以前的略大一些 合金机身很有质感 没有??按键还不太适应 媳妇很喜欢
a***2,star5,超级实惠，而且是4g版的，装上卡走到哪用到哪，买给媳妇的，粉色超级可爱，运行速度超级流畅，带指纹解锁，唯一的遗憾就是256g的木有优惠
咖***美,star5,发货速度十分快，今天收到货了。包装盒完好无损。外观材质：采用铝合金材质，天蓝色十分青春有活力，后摄像头凸起，顶端指纹解锁，音乐调节按钮有点小。屏幕效果：做工精致很好，屏幕显示效果十分好，运行速度：14处理器十分给力，多方面使用处理快，方便快捷。轻薄程度：十分轻薄，上手体验效果非常不错。其他特色：2020新款Air4十分好看。屏幕尺寸10.9 英寸，触摸平顺平滑。数据线两端都采用C口，扩展资源更加丰富。20W的快充能有效更快的进行充电。
c***o,star5,屏幕效果：清晰度很高，娱乐办公完全没问题。运行速度：速度很流畅，再加一个键盘就是笔记本了618买的pencil套餐，针对很值
阿***D,star5,新一代产品就是好用摄像头像素加强了好多！??????而且比上代更薄更轻了??全面屏的而且解锁超级方便，感受到了科技的力量！???蓝色的感觉不错，很出众，漂亮在京东买电子产品放心！??????
A***a,star5,外观材质：超级棒的，手感很好，比之前的8代好太多，当然价格也贵好多屏幕效果：很好，看电视打游戏很棒运行速度：很快，虽然是去年的一代，但速度真的是一流的，用几年都不会过时轻薄程度：很薄哦
欧***无,star5,这次买的东西很贵，选择了京东自营，放心些，毕竟快递太暴力了。苹果的平板确实做的很好，淡蓝色的外壳，一点瑕疵都没有，屏幕画质很细腻，音质也很好，内存256GB，足够用到娃娃小学毕业了。
A***p,star5,使用很丝滑，而且颜色超级好看。屏幕很大，特别舒服。也比较轻薄～快递物流很nice！一天到！刚到的iPad电量是80左右，完成开机之后也没怎么特别掉电。内存256g可用243g也不错。跟iPhone相连之后，都能共享。很智能
么***n,star5,好爱呀⁄(⁄ ⁄•⁄ω⁄•⁄ ⁄)⁄羞羞   买起来家人们  我吃土都买了外观材质：两个字 高级屏幕效果：超棒运行速度：很快  不卡顿 超级喜欢超级好用轻薄程度：很轻薄其他特色：高级
月***6,star5,昨天买今天到，疫情期间，太棒了！室内灯光下灰色，在阳台看蓝色，神奇的高级色。体验感超强，手感超级好！
那***8,star5,这薄如蝉翼感觉，爱了！这丝滑的手感。这头顶绿的颜色。以及一如既往的好品质，非常喜欢的一款产品，非常棒！o(*￣︶￣*)o
刘***呀,star5,功能：苹果平板的功能真的强大，选择苹果的也是有原因的，要画机械制图，苹果平板可以运行起来，而且一点也不卡，携带也很方便。外表：买的蓝色的，感觉还挺好看的
j***3,star5,终于到手了，手感不错，轻重合适，反应速度还是快，非常喜欢
富***花,star5,外观美，重量又轻，发货速度快，前天买的，昨天下午就到了，体验效果很好，续航时间，比较长，体积大，四孔扬声器，效果很美妙！听着令人心旷神怡，容易上手！
w***3,star5,外观材质：外包非常简约耐看，质感不错运行速度：速度没问题a14加持，杠杠的。屏幕效果：屏幕效果非常非常满意轻薄程度：比ipad6代感觉提升了一个档次，轻薄，手感好好啊家里已经有一台ipad6代了，主要是老婆看剧看电影和孩子线上课程的学习使用，基本上我就没怎么轮到我。入手便于平时轻度办公以及看书学习使用。
君***丶,star5,HJ很不错跟我的12配合用，用起来很流畅，的非常完.美的一次购机体验，无敌终于收到货了，●、性能很好，合搭配使用笔，直选择苹果系统没问题，蓝色非常好看，◆觉得蓝色更耐看，而且颜值很高，我都很喜欢
s***t,star5,双十一期间购买，京东物流还是很有保证的，很快就送上门了。机子本身没老iPad重，拿着比原来轻松。屏幕的色彩感觉比原来家里老的更好。新机使用起来是很流畅的，电池比原来下降的快。好在快充加持，充电也快了。
j***念,star5,京东618周年，之前加购的这款有降价还赠了耳机，下单到货快，到货验机是新机，苹果一体机手机耐用，这款平板有质感，新色好看，指纹解锁灵敏，屏幕音质清晰，运行速度快，一直爱奇艺视觉舒适，触屏按键灵敏，一同下单的保护套钢化膜质量很好很匹配，还会在京东购买触控键盘等配件，还有会员专享，信赖京东
买***治,star5,幸福是每一个微小的生活愿望达成。这款是送给妈妈的圣诞节礼物，24小时前呢她就是图中小熊屁股下的那个礼物盒子。看中air4的颜值，然后是扬声器，对妈妈而言，显示和声音效果就是生产力，此前她用的是air一代，换了这款能够提升她的生活舒适度，我觉得还是很划算。很满意，自营肯定是放心的，开心的圣诞节，完美。
j***b,star5,因为预算选择了64g，打造一个学习型的iPad应该够用了，为了避免买前生产力，买后爱奇艺的问题，那就干脆不要下载就好啦。运行特别流畅，听歌的音效很舒服，pencil的压感很好，做笔记和绘画都好用的，教资冲冲冲！
阿***2,star5,买了一段时间了，觉得非常好用，苹果用习惯了还是喜欢这个
王***-,star5,灰的很耐看，机子很薄，性能啥的我也不懂，就买来看看视频很清晰，有过卡顿会闪退
q***6,star5,外观材质：这款air真的好看，裸机手感也特别好，终于把○按键取消了。屏幕效果：这个是air4，去年买的air3，iPad用习惯了，看到屏幕感觉真好，看电影，打游戏，还是越大越好，现在不用手机玩了，失宠了，回家手机就放一边了，哈哈。运行速度：14的系统，a14的处理器，正常应该很快，单用到app会出现卡下和闪退，无语了。希望是系统问题。air3好像升级到14后感觉也没这个现象。轻薄程度：手感好，非常好，怀旧路线，和12的设计差不多。其他特色：浅蓝色好看。也上个air3的相片，以后家里最好人手一台。
小***买,star5,买之前看有些差评还心慌慌，到手之后，我把评论说的什么声音呀，屏弯了呀，都看了，什么都没有！简直好得不能再好咯！我要我的平板成为生产力！练字也练了，画画也画了，做笔记也试了～超超超级爽哦～实现无纸化，还丰富了我的笔酷呢～做些错题集啥的直接扣图和拍照，可比手写方便多了～总而言之，很满意啦
如***r,star5,"iPad Air（第 4 代）采用10.9英寸的liquid视网膜显示屏，屏幕采用全层压显示屏，拥有广色域显示，原彩显示，以及反抗涂层,采用超窄边框的全面屏设计风格，机身线条棱角分明，机身外壳为再生铝金属材质打造，外观方面很好看，性能处理也很爆炸，遇上京东搞活动，价格和很是优惠，性价比很高！"
小***啊,star5,总体来说，确实很不错，这是我的第一个苹果产品，选了好久，在过年活动期间拿下，超激动客服的服务态度也很棒，说话几乎马上就会回消息，物超所值，真心推荐外观材质：见图屏幕效果：不亏是苹果，就是清晰运行速度：很快，比预计时间还早了一天，到货那天是我生日哈哈轻薄程度：挺薄的，颜色我超喜欢，配了黑色的壳子哈哈
等***阴,star5,外观材质：摸起来手感很好，非常舒服，质感也是很好的屏幕效果：屏幕花色还是非常不错的运行速度：运行速度非常快的轻薄程度：比较轻，单手拿着也是非常不错的选择的音效也是很好的，用来看学习非常不错
我***香,star5,外观材质：一如既往的优秀，手感一流，有磨砂感。屏幕效果：非常清晰，基本上是100%还原。运行速度：没有感觉任何卡顿。轻薄程度：是一个很能接受的重量，不重。总体来说，非常满意。
P***g,star5,这个是拿air3以旧换新的，air3用了快两年了，一直也很好用，正好这个818有活动就换了，用了两天了这是A14的处理器用着很好，外观个人感觉比air3好看。
a***b,star5,非常棒，快递速度超快，原本说23号才能到，结果22号就到了，为京东的快递速度点赞，平板电脑很好用，外观也很漂亮，软件流畅，外观漂亮，操作舒服
困***钱,star5,外观材质：质感很好屏幕效果：显示逼真 清晰不伤眼运行速度：简直太流畅了轻薄程度：很轻薄 大小也合适 用起来舒适感up其他特色：给老公买的 玩玩游戏看看视频挺好的 拿在手里简直太美好了
黑***李,star5,好看，天蓝色太好看了，简简单单几句评论没法描述它的美感，很轻薄很没有我的手机沉，运行速度也很快，买的内存比较小，主要就是看看电视，所以我觉得就够了，还在犹豫的朋友，可以不用考虑直接入手了，不光我一个人说它不错，自己喜欢的东西，不用看评论也会买
j***i,star5,绿色很好看！用起来很流畅，画画做笔记很实用。重量也很轻，屏幕大小也很合适！充电头换成了新的那种，不能跟之前的充电线混用了
摩***的,star5,外观材质：摸着很舒服屏幕效果：屏幕容易脏，但是看着很养眼运行速度：速度不容置疑轻薄程度：比较轻薄其他特色：第一次入手iPad，自我觉得还可以吧，快递非常快，一天就到了，颜色也比较喜欢！
j***o,star5,发货速度快，物流速度也快，京东物流值得拥有。商品收到就立刻打开了，很喜欢，很高级的颜色，厚薄程度适中，屏幕大小也刚刚好，画面效果不错，运行速度也快。
桃***5,star5,外观材质：外观设计感强，简约。屏幕效果：屏幕看着画面很舒服。运行速度：舒服很快，运行很流畅，不卡顿。轻薄程度：轻薄度适中，方便携带。其他特色：朋友推荐的，性价比很高值得购买。
j***p,star5,好！我第一天傍晚下的单，第二天早上7点就给我塞近邻宝了，巨快无比，但是塞近邻宝还是让我很担心哈哈哈哈！拿奖学金买的，用起来还不错，希望可以用久一点
龍***年,star5,超级棒，苹果的iPad Air4感觉就是不一样，做工精致，运行流畅。包装盒子的细节都非常人性化。目前还在使用中，不同于Android系统，得有个适应过程。相比较，性能差不多的情况下，消费者往往会选择更便宜的。
T***O,star5,给女朋友买来看电视，手机屏幕太小了，还是大屏幕看着舒服，也不用来干别的，64够用了，再加上过年京东红包，优惠也很大，机不可失，
j***a,star5,早就想换新的i Pad了，一直没有下手，终于等到618大促，还好没有让我失望，果断入手玫瑰金色的，256G的能存很多文件了，不用担心存储空间不足了。
浮***0,star5,性价比超高的一款，不到4千入手，还有12期免息，划算，外观非常漂亮，超薄。a14仿生芯片处理视频、图像、办公文字毫无压力，使用顺滑，运行速度快，和pro一样的真全面屏，屏幕分辨率高，滑动流畅自然，唯一遗憾就是没有高刷，但是考虑到续航，还是忍了，待机时间长，续航给力，触控ID很方便，买的是天空蓝的，拿在手上非常nice，京东的物流太快了，服务太给力了，买数码产品我只信京东，上一个ipad可以光荣下岗了
t***7,star5,非常满意的电子产品啊！苹果产品质量就不用多说啦，买回来给孩子上网课用的，非常方便！屏幕大小也，学习娱乐两不误，运行速度很快，很流畅的！
呜***了,star5,iPad Air第四代，移除了Home键，正面外观大气，背面采用磨砂喷涂工艺，手感非常好。天空蓝的配色和我的远峰蓝13Pro很搭。整机十分轻盈，搭配立体声扬声器，看电影玩游戏效果很棒。搭载的A14芯片同样也是十分强大！是一款性价比极高的iPad。
狗***晴,star5,屏幕效果：屏幕非常清晰，运行速度很快。轻薄程度：非常轻薄，拿在手上很合适，不会笨重买来画画和追剧的，体验感很好，颜色建议蓝色和绿色，特别神仙，不会看腻，别犹豫了姐妹们，买它不会后悔，个人觉得比pro款更合适指纹解锁功能也很灵敏，基本一触发就解锁，还可以录入两个指纹，可以把男票的也录入进去，总之非常棒快递物流没的说，付款次日达，这点京东一直做的不错
丿***n,star5,外观材质：天蓝色，比以往的都好看，直角切割拿着更有手感。屏幕效果：看电影2k效果绝对没的说细腻很运行速度：上部iPad mini2  七年了太卡了，换iPad Air**起飞，别我xr用着都舒服轻薄程度：薄，惊艳，但是就是太大了太大了，当电脑配键盘鼠标用非常爽其他特色：办公舒服，手写笔拿来画画真好，真香
j***u,star5,看了很久最后还是选择了这款，跟闺蜜一人买了一个哈哈哈哈哈哈，趁着优惠，赶紧入手，是正品，包装也非常的好，没有破损，质量也是没得说，用来追剧很方便，非常奈斯！！
