https://item.jd.com/100028057022.html,品牌： Apple商品名称：AppleMME73CH/A商品编号：100028057022商品毛重：180.00g商品产地：其他货号：A2565,A2564,A2566类别：音乐耳机连接方式：无线，蓝牙佩戴方式：入耳式
d***o,star5,很方便，听歌看书的时候用特别方便，坐公共交通工具的时候，不希望音量太大打扰到别人，真的很有必要，从一代用到二代，还是继续用
康***糊,star5,继手机之后的第二个苹果产品了，音质很好连接很快 灵敏 北京发货越南产 质量没问题就没换 佩戴起来对我的耳朵来说很舒服！喜欢这种胖乎乎大头的耳机设计 电子产品买新不买旧总体还是很满意的
j***j,star5,耳机用了有一段时间了。感觉还是非常棒??的。音质音效非常好，跟iPhone搭配起来特别丝滑。开盖自动连接，非常方便。不许哦
s***y,star5,啊，这到底是什么神仙速度呀，这什么速度呀，早上下单，下午就到了呀，好离谱呀，耳机特别的小巧，挺好的，这个耳机还会回购的呀！
u***q,star5,安卓换苹果，纠结了很多天，买不买这个耳机看了评论，果断买了，今天用了一下效果很好，充电也快，推荐购买！
微***k,star5,耳机的音质非常的不错，就是这个新款是需要按压的，之前的耳机都是触摸一下，可以切歌接听电话。总体来说音质还是非常的棒。待机时间也是很不错的。
-***胖,star5,拿到货了，特别激动，赶紧打开，宝贝真的很不错哦，外观很精美，质量也很不错，赶紧体验了一下，觉得真的是物有所值啊，值得回购，喜欢的小伙伴们就不要犹豫了，赶快下单吧！
j***I,star5,苹果的耳机一如既往的品质好，带着舒服，带两三个小时耳朵都不觉得痛，音质也好，外观大气上档次，开合的质感也很棒棒，值得推荐
满***8,star5,不错不错很不错，这个手表太棒了，一下买了好寄几个，真的是太棒了，下回还要继续买，买买买，好好好，希望继续加加油。厉害了哈。好的很。
j***j,star5,耳机到了，送货速度非常快，体验不许哦。耳机???????很nice，家人很喜欢，用起来十分方便。音效没的说。很棒
梦***停,star5,苹果不骗穷人，除了贵没别的毛病，穷是我的问题，耳机使用感觉太棒了。跟iiPhone搭配起来十分合适。用起来也很方便，开盖直接就连上了
肉***人,star5,京东电子产品一直质量有保证，特别是活动时候还有补贴，就非常划算了。这款耳机音质很棒，戴起来我很舒服，续航也不错，做工质感细腻。
o***e,star5,表妹刚高考完，送给她的毕业礼物。物流超级超级快，头天晚上下单，第二天就到了，三代比我的二代盒子更宽一点，不知道效果怎么样，应该不错
j***h,star5,用上了，非常好??，京东自营物流非常快，头天拍的，第二天就到了！续航目前刚开始用，过几天再来追评！喜欢的人直接入手吧！
N***F,star5,买给老公的，老公特喜欢，不仅是因为质感，还有音效，最最最重要的是有他喜欢的英文名称，拿到手之后老公都不相信这是买给他的，直到看到英文字后，他悟了哈哈哈
东***了,star5,主动降噪效果好。给老爸买的，他很喜欢！非常烦躁。希望快一些。用了一段时间才来评价，买之前先在苹果专店试戴过，到货后就迫不及待使用，发现和在苹果专店试戴的效果一样！续航能力：对我来说比较合适。
l***3,star5,耳机音效很????????。颜值特别高。带上之后不用担心掉落的问题，续航很满意，充一次电可以运行24小时。够用了
j***j,star5,耳机可以设置空间音效，很不错。二代掉了之后换的耳机三代，立体音效非常的有体验感，听歌的感觉一下子提升了。但一定要保管好，很容易掉。
j***S,star5,苹果耳机真的香啊，虽然贵，但是我觉得贵有贵的道理，使用起来非常的好，音效非常不错，听歌流畅，玩游戏也非常的好，和队友对话都通畅起来了，非常的舒服，物有所值
偶***火,star5,Apple AirPods (第三代) 配闪电充电盒 无线蓝牙耳机 Apple耳机 ，耳机收到了，蓝牙链接很快，音质也很好。
飘***远,star5,音质很不错，低音效果很棒，比之前买了一两百的效果好很多，果然是一分价钱一分货，体验了这个之后别的耳机就听不惯了。续航也杠杠的，充满用一天不在话下。
j***2,star5,快递包装很好，没有出现压盒的情况，物流也挺快的。音质和音效都不错，出门半天都有电，续航能力挺好的，降噪效果还可以吧，在图书馆用很合适。
N***0,star5,23年国产，快递很快，包裹包装的很完整，仔细检查产品外观也没有瑕疵，音质还可以，空间音频效果很好，戴起来很舒服，非入耳式戴着没有不适感，适合与pro搭配不同场景使用。
j***f,star5,美观大方，打电话可以解放双手了。生产工具属性十足。听音乐音质也非常好。心仪已久的耳机终于到手了，马上投入学习听课。也不担心吵到家人了
不***家,star5,苹果的耳机真的太好用，太好用了，性价比非常的高，为什么说它高呢？因为这个价位的耳机真的没有它那么好的啦，已经降噪的功能太无敌啦。而且音质方面也非常好，非常好。
会***怪,star5,一口气购买了10多个苹果设备，我只能说苹果最近真的越来越戳我心头了，东西都很好，而且生态也逐渐跟上来了，也兼容很多其他的配置，满足！！！而且感觉现在越来越倾听群众声音了！系统拉满！apple yyds
-***憨,star5,好用，爱用，一直用，哈哈哈哈哈。已经在京东上买的第三个苹果耳机了。音质真的不一样，一个送弟弟一个送闺蜜都说很好用，而且可以换各种漂亮的耳机壳字啦。
j***q,star5,非常的好用，续航很不错，每次都能听好久，这是第二次买了，以后还会选择这个牌子，颜值也蛮不错的，小小的很轻便，非常适合上班族
z***0,star5,买给别人做礼物的，很不错哦，音质很不错，高大上，很喜欢。快递也很到位，第二天就到了，正品有保障，?自己过段时间也买一个，?
东***帅,star5,买到了中国制造，这下就放心了。半入耳式的，没有觉得很胀耳朵，适配苹果很便捷。续航中规中矩，带个两三天完全够用，毕竟也不可能一直带着。盒子大小比一代没大多少。
M***0,star5,以前不知道评价可以得京豆，错过了好多啊，现在努力补救一下，小巧精致，便携，无线耳机真的很方便，上班使用起来超爽的，哈哈哈哈哈
丹***玫,star5,选了好多家，最终选定了这款，一点都不后悔啊，好喜欢。。。京东物流真的绝绝子。。比逛商场效率还の高高。。。。以后如果有需要一定会回购哒。
帅***郭,star5,京东物流配送速度非常快，快递小哥服务非常好。产品非很好，白色简洁大方，摸起来非常细腻。戴起来很舒适，音质清晰，听歌的不二选择！
h***f,star5,朝思暮想的耳机，奈何因为价格一直不舍得买，这次活动，下决心搞到手，真香！佩戴舒适，音质不错，不管是打游戏还是听歌曲看影剧，都是相当给力。
j***6,star5,连接速度很快，刚开始用久耳朵会涨疼，续航能力比我之前买的杂牌的要好许多，质感挺好的，拿在手上不会轻飘飘的，音质也挺好，总体来说还不错
j***5,star5,首先快递盒就很严实，其次外包装没有损伤，耳机是正品，很轻，音质很号，自动排除噪音，戴在耳朵里一点也不发胀，充电也很快，完美的耳机，成功上岸。
是***月,star5,续航很棒，给女朋友买的，自己也买了一个，无线充电真的很方便，续航单耳机大概5小时左右，平时足够用了，充电仓大概够4次左右充电
冰***8,star5,买给高考生外甥女的高考礼物，之前一直用的2代，大学生了新款3代更换起来，外甥女很喜欢，收到就试听了，耳机改良后更舒适，长时间听歌耳朵也不会疼了。
梦***i,star5,苹果耳机质量很好，做工一流，手感很棒，用起来很方便。音质不错，带着很舒服，京东自营购买比较放心，快递速度很快，服务很好。
f***3,star5,做工一如既往地好，音质音效没的说，连接苹果手机非常简单快速，无线充让充电更加随意，还有定制功能，一点不耽误发货时间，值得拥有
是***月,star5,正品就是不一样，弹窗慢而且不会尴尬的链接到别人的手机，无线充电很方便，现在这款很有性价比，比pro 少了一个主动降噪，平时用用足够了，续航很棒
开***y,star5,耳机音质非常好，长时间佩戴也不会觉得耳部不适，并且防汗防水，续航能力超强，配有无线充电功能非常方便！京东购物非常放心，送货和售后服务都很好，非常满意！
艾***呢,star5,这是一个好评模板。因为我是很懒的不想每个产品都写好评所以特地写下这个模板，以前不知道评论可以涨积分，现在才知道好评的重要性，妥妥的每条都来评论下，赚积分，下次还能抵现金用。评论80个字以上，可以得到50个积分，我无论买什么东西都会把这个段话复制粘贴下凑够字数，这是第N次在网上买东西了棒捧棒，东西便宜而且质量好物美价廉买的放心，用的开心，感觉都买上瘾了买买买，根本停不下来，东西品种多而且又特别全划算方便，而且实惠，包装很好，而且没有任何损坏会一直支持下去的，服务还可以一超级好用，好评下次再来
徐***4,star5,质量很好，送来的时候外包装也很好，没有破损，送货速度很快！！很不错！！音质一如既往的好！大家可以购买，正品，没问题！推荐。
来***圆,star5,买来送给弟弟的，他非常喜欢在我面前夸张了好多遍，这个儿子说做工好说，音质好说非常的方便还支持无线充电，看他玩了一整天爱不释手的样子，真的很开心。
草***儿,star5,出门旅游把原来的二代丢了，要换肯定换新款，因为带不了pro版容易掉，就买了四代这款，比起二代进步了很多，特别喜欢空间音频的效果，体验感很好?
u***z,star5,活动买的有优惠，物流很快，下单转天就收到了，没耽误使用。音质很好，不易掉落，带着运动很棒，听着音乐跑步都带劲了。很赞非常满意。
j***a,star5,产品到货时间很快，京东快递还是有保障的，产品齐全质感不错，材料安全，工艺很自然，操作方便，使用简单便捷，外观设计舒适美观。
e***e,star5,哈哈哈很好的耳机 好喜欢 在地铁上面带着耳机实在是太舒服啦 hhh很满意哦 如果还有需要的话还会再一次的购买哦 快递的速度也十分分快递俩天就到我手上啦 哈哈哈不很满意
老***三,star5,京东这次618活动优惠力度挺大的，耳机给家里人买的，和iphone搭配非常好用，音质不错，佩戴舒适，携带方便，满足了基本需求，京东送到家
谢***伟,star5,Airport 3代依旧的好用，音效感觉比前两代有了很大的提升，空间效果也很好，音效环绕感很强很强，性价比很高的一款，续航也很不错，推荐购买。
m***7,star5,不管怎么说。价格很贵。但是带来的享受也是很不错的。我喜欢这款耳机??。音质音效特别棒。充电续航也很给力。一次可以用2天
木***-,star3,会有滋滋滋电流声，踩雷了，唉，音质可以
j***i,star5,耳机已经收到货了，对比了好几款决定买这款，这款性价比很高，而且试听音质超级棒，立体感比老款舒适，充电也很方便，充一次能用好长时间，总体很值得！
-***-,star5,这款的颜值非常好看，比之前的两款更让我中意，音质的话一直是对的起他的价格，待机时间也很感人，买回来很久了，到现在还没充过电，
L***1,star5,耳机很好用，买给妹妹的  高中毕业礼物   耳机连接很顺畅    可以连两个苹果设备   配套的各种保护壳颜值也非常高
j***j,star5,耳机不错无论材质还是做工都超出了预期，超值，穿起来也很好看哦。卖家发货也比预计提早了很多，还会再来。买吧，不会后悔的哦！全五分。
甜***酱,star5,正品耳机音质听起来就是不一样，恨不得整天都能带耳机，听歌感觉太好了，非常喜欢降噪模式，根本听不见旁边的吵闹声了哈哈哈哈。
小***可,star5,这个苹果无线蓝牙耳机很好用，充电也很方便，哈哈哈，快递很速度，昨晚下的单，今天早上就送到了，包装很好，没有破损，快递小哥很赞
u***o,star5,本人入手的第一款苹果蓝牙耳机，官方旗舰店上的都是正品，秒连接，100%兼容很多社交app内语语房内播放音乐的质感，音质初试很Nice！音质和电池情况煲机一周后再追评。
l***3,star5,上一代的pods用了好几年了。这次换新?还是选择苹果?。跟手机?的适配太合适了。音质音效非常nice。老婆很喜欢。很满意
甜***酱,star5,正品就是不一样啊，听歌音质超级好，降噪开了好像与世隔绝了，续航能力杠杠的，开关声音的金属质感也很高级，太好用了太好用了。
h***8,star5,非常不错，还得是苹果自家的耳机，之前用过别的品牌的，匹配不是很流畅，用一款简直就是丝滑。音质也够用，毕竟不是专业设备。京东物流很给力，隔天中午就到了
j***f,star5,东西可以不错非常好看也好用的很，非常的喜欢，不错的东西，希望大家购买，啥也不说了，京东可以，自营的很棒很棒，一样的喜欢，不错不错
妥***啊,star5,在京东苹果买的第二件耳机了，之前的已经光荣下岗了，送货速度简直太快了，而且品质没差，选择京东苹果是没问题的，非常喜欢，非常不错！
t***y,star5,送礼用得，收礼人很开心，送到心坎里了，女人就喜欢苹果，女人啊，女人就喜欢苹果，苹果功能用不到多少，服气服气服气，需要好多钱
V***s,star5,一分钱一分货，确实不错。戴久不会痛，音质比我之前两百多块的好很多，降噪效果也很好，618入手价格合适。不知道还是不是歌尔代工的。
A***o,star5,苹果耳机收到啦！一直想要买无线耳机，终于在搞活动等我时候下手买了，非常好(?˙︶˙?)快递非常的快，包装也是一如既往的好，很满意很好
j***d,star5,喔，这个耳机真的超级超级无敌。全新国行正品，颜色超级好看。发货速度最快。是的就是自己做不出来我真的觉得你不，好吧一次我觉得这件宝贝我的。音质超级无敌。在于如何正确地打开方式进行，未激活未拆封。价格超级实惠。
李***了,star5,京东618活动太给力了。叠加满减券。性价比很高。耳机音效很好，带上后感觉就是另一个世界。苹果的产品果真就是棒??。我很喜欢
j***6,star5,发货快，买苹果产品都会选择京东，第一不用等太久，第二质量有保障，配送员配送很及时，苹果的产品还是一如即往的OK，音效可以，续航能力也很好好
j***e,star5,收到耳机后很惊喜，性价比还是蛮高的。包装精美严密，看包装好高大上，从包装就可以确定是正品，拆开后耳机很有质感，亲肤很顺滑，外形设计的也很特别
温***哥,star5,很不错，很不错，耳机非常的不错，相当的满意。感觉这个价位苹果的耳机是真的一流的，没有其他的耳机可以比较。空间音频功能太强大了，玩游戏真的很好。
C***_,star5,真是有苹果手机就想凑齐苹果三件套，这次直接入手了AirPods三代，苹果的交互还是挺牛的，音质也OK，尤其空间音频特别耐斯！
靛***蓝,star5,东西很满意，客服超级有耐心，服务细致贴心，趁着有活动优惠，赶紧入手，是正品，性价比很高，包装完整没有破损，质量没的说，很好，还会回购的。非常喜欢，朋友也觉得很不错。
向***啦,star5,用的还不错，音质不错的，卖家服务态度好送货上门，包装的非常精致蛮上档次的！以后耳机首选就是你家了！不错的，多推荐朋友来买！
s***s,star5,- 直没用过正品的 AirPods， 现在体验到了，果然一分去一分货，抛开音质，降噪透传还有空间音频真的吊J其他耳机，体验很好。
j***N,star5,老板让自己买的员工奖。还没拆封，看起来不错的，包装盒子质感很好，也很坠手，满意。希望后续用的时候不要掉，哈哈哈......
e***e,star5,买的耳机终于到手上啦 很满意这一次的购物 很好是送入我朋友的 朋友很喜欢 而且到的速度很快 俩天就送到了我的手上 哈哈哈 如果还有需要的话还会再一次的购物 hhhh很开心哦
u***3,star5,买来送人的礼物，苹果耳机一直很稳定，这款相对来说性价比还是很高的，还是无线耳机好用，没有线的束缚，粗心大意的人不要用，真的怕丢了
浅***蓝,star5,大品牌值得信赖。卖家态度很好，很耐心，有问必答的，值得点赞，老板记得加鸡腿。东西好看，配色合理，产品功能齐全，使用感佳，值得购买，有需要会回购。
紫***4,star5,很不错的耳机。性价比超高。趁618打折的时候购买的。价格很不错。我很喜欢。非常高。物流速度一般。可能是618的原因。总体来说还是不错的。
l***6,star5,京东自营一如既往的好，发货神速，广州市内当日送达，耳机音质清晰，氛围感十足，戴了一天也不压耳朵，很舒适，体验感非常NICE的一次购物。
u***n,star5,包装完好，无破损，外层放的有充气泡沫，没有挤压变形等，两个角都贴上了封条，值得信赖，百亿补贴后的价格也很实惠，行嘉宾好，推荐购买，是正品！
李***民,star5,有了手机配个耳机，价格贵性能稳定，耳机使用起来清晰明亮。电池使用的时间基本够我每天的日常生活，上班路上公交车的搭配性能都很棒
腾***安,star5,快递包装还不错，外壳没压到很好，苹果的音质就是不一样，对自己好点入手了一个，开心开心。京东的商品值得信赖，非常棒！哈哈哈
颜***芳,star5,耳机?非常棒????????。苹果家的产品很值得信赖！音质音效特别棒??，虽然不是发烧友，这个音效真是太好了
成***6,star5,价格便宜量又足！实惠包装设计大方漂亮，美丽动人心魄，上档次！音质很好的！漂亮！物流速度有目共睹！快！很快！服务态度很好！
j***s,star5,非常满意的购物，对比了很久入手的，在618活动入手，非常划算满意，心满意足的购物，使用非常舒服，相当满意，非常推荐购买，快来购买购买
圆***i,star5,苹果耳机一如既往的好用 和苹果手机互动非常好 价格也很优惠 这段时间使用下来各方面都很满意 物流速度也超快 第二天就到了 五星好评
黄***郑,star5,给孩子配的iPhone14的耳机，孩子非常喜欢，考完试也算是奖励吧，苹果互相搭配效果就是好，京东物流也快，遗憾没赶上618促销
n***t,star5,用起来音感超级好，而且带起来很舒服，尤其是搭配了手机效果更明显，有智能功能转头后音质的变化以及小巧的外观更是让人满意了。
焕***g,star5,在搞活动入手，简直不要太划算，京东物流非常给力一天就到手，airpods链接方便音质也很好，佩戴舒适，非常给力了！京东给力
j***2,star5,物流很快，包装也不错，价格优惠，618真的很给力，是正品，东西很不错，耳机适配度很好，很好用，点赞，希望下次还能有机会回购
热***3,star5,618这次苹果的活动优惠力度真的超级大，比平时便宜了两三百，很开心耳机盒里又送了我一根数据线，和手机充电线一样，我又自己买了个充电头，充电头也比平时便宜了150，到手价应该更低。我又可以在两个地方充电不用来回拔充电器啦。
h***6,star5,很精致，很棒。虽然贵但是不后悔。之前都是用的别的牌子200-300价位的蓝牙耳机还是苹果自己的好啊。果真用了苹果手机之后配件也要慢慢配齐
j***4,star5,晚上 11 点多下单，第二天上午也到了，京东的速度还是没得说，快递员服务也非常好，商品包装完好，续航能力优秀，音质清晰。
j***8,star5,这是自己的第三个耳机了，一直用的苹果系列，没有踩过雷，品质有保障，收到货立马使用，音质一如既往的好，耳机的颜值也很高。。
茶***3,star5,第一次在京东自营店买电子产品，没想到出乎意料的好！是正品，做工精细，手感极好！音质也不错！而且发货特别快，第二天就收到了。
李***民,star5,耳机物流特别快的收到货啦，京东自营快递的速度越来越快啦，鼓掌鼓掌，耳机质量没得说，做工精细质感非常棒，耳机使用过程的舒适度好
e***e,star5,哈哈哈 非常满意这一次的购物 如果还有需要的话还会再一次的购买哦 第一次买到自己喜欢的ipad 哈哈哈 很开心 使用的的感觉很好 打游戏还是看电视都很开心 hhhh
小***几,star5,真是一次难忘的购物，这辈子没见过这么好用的东西！！经过了这次愉快的购物，我决定如果下次我还要买耳机的话，我一定会再来这家店买的。不错不错！包装的很精美！耳机的质量和品质非常不错！收到货后我非常的开心，因为耳机的质量和品质真的非常的好！拆开包装后惊艳到我了，这就是我想要的耳机!
