蔡***运,star5,依然那么帅气的苹果13，我买的256G的，星光色的神秘稳重，很有质感，而且大小，外形非常喜欢，拿在手里非常的舒服。手机背面是玻璃亮镜面的材质，这种磨砂与亮面的搭配，看上去非常大气，很上档次，太喜欢了，嘿嘿。
氺***恒,star5,外形外观：完美屏幕音效：正常拍照效果：正常运行速度：很快待机时间：还不错目前性价比极高的机型！合适做备用机或者给老人使用避免安卓的垃圾推广app
c***9,star5,一直都在京东买东西，跟商场的一样，是正品，而且一般都有很多优惠，价格本身也很优惠，质量也有保证，快递物流超快，今天买，第二天就能到，非常好的消费者购物体验，产品包装也严实，很仔细，非常满意！
企***儿,star5,这款手机性能出色，搭载了强大的芯片，运行流畅且快速。我可以同时打开多个应用程序而无需担心卡顿或延迟。屏幕的显示效果非常出色，色彩鲜艳，细节清晰，使我享受到更加逼真的视觉体验。另外，苹果13的摄像头表现出色。它拥有强大的拍摄功能，可以捕捉清晰、生动的照片和视频。无论是日常生活中的美食照片，还是旅行中的风景，都能得到出色的效果。
吖***春,star5,618买性价比还可以外形外观：规矩，舒服拍照效果：苹果相机一如既往品质很高运行速度：很快待机时间：新手机待机时间一天没问题
j***7,star5,一家人前后买过四台苹果手机，苹果的系统真心可以，上一台是6P，其实还是挺好用的，日常使用也不会很卡只是听筒坏了，要开免提或耳机，趁着618活动，买台13。颜值在线，运行流畅，待机时间也可以。非常满意，好评！
牛***望,star5,苹果13收到货了，迫不及待的打开包裹，映入眼帘的是非常精致的外观，很好看，符合我的审美，激活也很方便，导资料可以一键导入，真心喜欢ios的系统很流畅不卡顿，整体待机时间也不错，实力推荐的好手机！！!
热***栆,star5,外形外观：苹果的机型一直都很好看屏幕音效：屏幕也好拍照效果：比11好多啦 不过还是xs拍照更好看运行速度：256g的内存够
甯***芯,star5,粉粉嫩嫩的超级好看！外形外观：太喜欢了，好看，玻璃质感好屏幕音效：可乐拍照效果：苹果的拍照没得说运行速度：目前还可没出息出现啥问题
j***g,star5,外形外观：粉色很好看，很粉嫩。屏幕音效：屏幕很清晰，音效很好很清楚。拍照效果：拍照效果非常好。运行速度：运行速度快不卡顿。
艾***璇,star5,一如既往的小苹果手机13，外甥女高考完挑选了这款手机，外形绿色壳的，速度杠杠滴，拍照视频没的话说的，好用！让她觉得很实用很完美，很喜欢！相信京东！
志***猪,star5,年质保棒棒的。拿到手就迫不及待的拆封了，做工很精细，机器运转流畅，苹果的产品好就好在你用了一段时间后还是一样的感觉，不会觉得会卡顿，好评，赞一个。帮同事买的，不是我自己用的，都好多年不用新款水果机了，咱也不知道咋样，手机收到了，质量很好，做工精细，款式新颖时尚，同事非常喜欢。觉得东西不错我就会给好评宝贝产品质量很好，是正品。运行速度：能用，不含糊。左右。
x***2,star5,外观颜值：非常漂亮 材质手感：非常好外，：简约大方，大气，上档次 直观感受：大气宝贝收到后很满意，外形颜色也很喜欢，挑选好多家，果然没看错，希望把好物分享给大家??
梁***语,star5,安全下车，是正品，东东给力，系统一如既往的流畅，颜值超高，特别喜欢绿色，活动也很划算，果断下单，是plus会员还有京豆返，一次愉快的购物体验！！
饰***运,star5,这款Apple iPhone 13确实蛮可以的哟，做工极其细腻，我自己也是才入手不久的，手机背板非常好看 整体质感不错 单手拿手里很合适。瀑布屏体验很棒 操作很灵敏。室内拍照使用体验不错 ，室外还没拍过。正常使用一天一充。100w快充真的太惊艳了。工作日可以早上起床开始充电，简单洗漱，吃个早饭。上班拿走的时候带上就满了。
2***4,star5,收到了试用三天，来做个评价，虽然是上一代的机子，但是流畅度一点不比最新的差，屏幕分辨率高，反应速度快，性价比很高，很赞
l***8,star5,这款iPhone 14真的是太棒了！首先，它的外观设计非常精美，每一个细节都处理得非常好，让人一眼就爱上它。其次，它的拍照效果非常出色，具有出色的分辨率和色彩还原能力，让我随时都能够记录下美好瞬间。此外，它的性能也非常强大，能够轻松应对各种任务和游戏。总之，这款iPhone 14是我用过的最好的一款手机，强烈推荐！
邢***峰,star5,绿色很满意的选择，非常高贵，突破常规的那种感觉。256G内存够用，手感不错。 操作丝滑。物流很给力，包装的也非常完美。赞一个！
丞***鸾,star5,外形外观：白色颜值非常高，入手的质感也很好屏幕音效：屏幕也很不错，打游戏非常流程拍照效果：苹果的拍照一直都非常能打，爱了爱了
喜***o,star5,京东物流非常快，一下子就收到了！手机很好看，背面是玻璃镜面的设计，非常的简约又不乏质感，触感也非常好。手机的配置也很好，清晰度特别高运行速度很流畅！
凌***汤,star5,外形外观：非常完美，爱不释手啊。屏幕音效：一如既往的nice。拍照效果：最爱苹果原相机。运行速度：再也不卡顿啦，游戏，视频非常丝滑
j***u,star5,外形外观：外观没得说，送人的，对方非常喜欢，也很好看屏幕音效：苹果手机的音效还行，外放一般般吧，声音不算大拍照效果：拍照效果挺不错的，有防抖运行速度：系统很流畅，用了几天，还在适应中待机时间：刚开始用，待机还行，基本一天一充
魔***树,star5,13的充电线变了，也没配充电头，手机还是很好的，从旧到新传数据也很方便，用个半天感觉就跟用原来手机一样。
U***7,star5,续航能力:很好拍照效果:清晰运行速度:畅快银色这颜	色真的太治愈啦，屏幕好大好爽，拍	照也特别清晰，非常炫酷!很有分量，拿在手里沉:甸甸的，触感很好，128G运行很快用着不发烫，平时待机的话比之前用的64g长了很久。信号也挺稳定的
j***v,star5,如图，实力貌美。手感很好 小巧便携 颜色巨巨好看！老婆们可以直接冲粉色 配透明壳也OK的。我觉得电量很够用、一天一充 充电到80很快 、会发烫很正常。隔一会就好不影响（有时候充电20～40%左右会发烫、后续就不会）通话音质正常 拍照很清晰 好看的～
寒***1,star5,外形外观：轻爆 大小一只手可以操作屏幕音效：高清拍照效果：绝了待机时间：?电池蛮大的 续航时间长运行速度：不管玩游戏 看剧 还是什么都很不错
-***宝,star5,外形外观：手机很好看，机型很好，颜值很高，黑色不失高雅屏幕音效：屏幕很灵活，触感很好拍照效果：拍照很清晰，喜欢用人像运行速度：运行速度很快，不卡顿
咿***y,star5,好看好看好看！很好用。外形外观：美丽屏幕音效：好的很拍照效果：美丽好看好看好看好看运行速度：快的待机时间：长的，出去玩可以管一天，不打游戏的情况下
戴***0,star5,"运行畅快拍照清晰续航很好美,背面的镜面设计非常有质感,触感非常舒适。大屏幕也非常漂亮◆清晰度特别高，颜色还特别丰富。手机的配置也非常强大,处理速度非常快，光线条件不好的拍照效果也非常棒。另外,这款手机支持5G,网络速度飞快,有时我还用它搭 WiFi，可谓非常方便。总之,我非常喜欢这款苹果强烈推荐给所有数码控"
望***开,star5,外形外观：粉粉的，很少女拍照效果：拍照很清晰，很还原，像素不错运行速度：运行速度飞快，苹果机还是?的待机时间：新机待机一天都可以，也不用担心一下就没电
清***y,star5,外形外观：外形外观好看，拿在手里很舒服，质感很好屏幕音效：屏幕音效佳，很赞拍照效果：苹果拍照没得说，爆赞运行速度：运行速度很快，没有卡顿的，赞待机时间：待机时间可以，经常用的一天妥妥的
j***e,star5,外观设计苹果13的机身尺寸和重量与iPhone12基本相同，分别为146.7mm、 71.5mm.7.65mm和174g，依然保持了轻薄和易手握持的特点。它有粉色、藍色、午夜、星光、红色和绿色六种配色可造，其中粉色和星光是新推出的颜色，更加年轻和时尚。它的屏幕也是6.1英寸的超视网膜XDR OLED材质刘海屏，支持HDR10显示技术，显示效果清晰细腻，亮度高达1200尼特，对比度高达2000000:1，视觉体验非常出色。
小***o,star5,外形外观：外观简洁漂亮，造型时尚，颜色搭配合理，细节上也比较下功夫，做工精细。屏幕音效：带低音效果，音质非常不错。拍照效果：拍照效果非常好。运行速度：运行速度非常快，并且非常丝滑。
李***8,star5,外形外观：高端大气上档次，屏幕音效：能让耳朵怀孕真舒服。拍照效果：高清细腻光滑真实。运行速度：流畅快速，待机时间：待机时间长，其他特色：好喜欢。
我***吖,star5,外形外观：外观我选择白色的，整体线条非常流畅好看。屏幕音效：屏幕使用起来，丝滑顺畅，音质播放音乐很清晰。拍照效果：拍照很逼真，效果图片很好，焦距放大也能很清楚的拍摄运行速度：运行速度非常快，不愧是A15处理器，顶配呀，性价比指望他。待机时间：大容量电池待机时间很长，在不完游戏的情况下可以使用一天一夜。
j***b,star5,外形外观：简约大气，外形很好看，握持手感也不错屏幕音效：双扬声器声音效果好，屏幕显示非常清晰拍照效果：苹果的调校非常可以，无论是拍照还是视频运行速度：运行app不卡顿待机时间：一天两充
P***g,star5,外形外观：手感嘎嘎好，不大不小非常适合拍照效果：拍照效果和14调教的基本一致，很清晰很真实屏幕音效：双扬声器一直都是苹果的出色的点，也是不起眼体验感又拉满的一个优点运行速度：速度很快，系统很流畅待机时间：挺长的
泡***姐,star5,用了一段时间了，真的好用。没啥毛病，流畅外形外观：外形外观：好 屏幕音效：好拍照效果：好清晰运行速度：快蛮快的待机时间：时间久其他特色：好好好
q***z,star5,手表质感很好，做工精细，款式很漂亮手表功能强大，外观设计很好看，走时精准功能多样，功能齐全，可以自己调节，调节功能，很实用，很好用。
u***u,star5,外形外观：外观漂亮好看，很喜欢，拿在手里刚刚好合适，屏幕音效：屏幕非常给力很丝滑流畅，音效不错哦，拍照效果：拍照效果不错，很清楚，运行速度：运行速度很快，非常快，
j***1,star5,苹果13的外观，时尚精致，直角边框设计，看着小巧，方便携带！屏幕音效：屏幕显示细腻，鲜艳，看着舒服！拍照效果：拍照比较清晰，能满足日常生活需要！运行速度：运行速度很快
m***3,star5,手机送货很快速，外形外观：红色很喜庆跟本命年很搭屏幕音效：音响效果很好拍照效果：清晰明了，摄影多一个电影效果，自己也可以拍大片。待机时间：没有特别的超长待机，和以前的几款待机时间差不多。运行速度：流畅迅速。
采***衣,star5,多年苹果粉丝，买的经典白，很漂亮，手感很舒服。外形外观：好看，外形流畅顺滑，那手里很轻屏幕音效：声音很大，很不错。拍照效果：拍风景照片很不错！分分钟出大片！
鸡***网,star5,商品评价:外形外观:外观大气上档次，非常漂亮，辨识度高!屏幕音效:屏幕显示效果非常不错。拍照效果:拍照挺清晰的，就是拍的照片不好看。运行速度:手机运行速度流畅，丝滑。最好的是物流，速度超级快!
j***c,star5,最喜欢用苹果手机了，从iPhone 6到iPhone X直至现在的iPhone13…….外形外观：挺不错的屏幕音效：真的太喜欢了?拍照效果：拍起照片来特别好看运行速度：运行得很顺待机时间：待机时间久，基本上可以用上一天以上其他特色：OK
虎***6,star5,买了三台了，质量非常好，与卖家描述一致，孩子们都特别喜欢吃，版型很好，面料舒适，尺码标准，不沾杯持妆久，橘色系更加显白，洗完也很柔顺头发也不油了，屏幕清晰运行流畅，敏感肌用起来毫无压力，握感舒适不伤牙龈，每次炒菜都会放几滴，用起来和真人差不多，很舒服。很满意的一次购物。
j***e,star5,外形外观：高端大气上档次的设计屏幕音效：高端品质的品牌拍照效果：高清晰度的设计运行速度：非常快，满意待机时间：满意其他特色：满意
j***的,star5,外形外观：轻巧方便，上手容易屏幕音效：完美拍照效果：可以运行速度：非常流畅、待机时间：正常一天没有任何问题其他特色：不错哦……不错哦…………
2***o,star5,外形外观：直角边框手感挺好的，边框上有过渡圆角，不会有硌手的情况屏幕音效：屏幕显示很细腻，用了一段时间了，真的很不错拍照效果：苹果的原相机拍的很清晰，成片效果不错运行速度：平常流畅运行各种app，几乎没有什么卡顿的情况
夜***章,star5,商品评价:非常满意的一次购买！!首先，手机非常好 看，午夜黑色真的很酷炫!屏幕分辨率升级后的显 示效果很清晰，看视频和图片效果非常棒。其次 性能非常强劲，运行流畅，玩游戏体验很好。最让 我惊喜的是，电池寿命大大提升，一整天使用下来 还有很多电量剩余。同时，13代的拍照也有了诸多 升级，无论是在亮光还是暗光下拍摄效果都很出 色。总之，非常推荐购买iphone13!
j***x,star5,外形外观：外形十分好看屏幕音效：屏幕十分细腻拍照效果：拍照很好看运行速度：运行速度很快待机时间：待机时间也很长
w***n,star5,外形外观：非常漂亮，苹果一贯风格就对了屏幕音效：没的说，一个字赞拍照效果：还原度很好，就是看重它的摄像头了，不会过分艳丽运行速度：应该能打个五六年吧待机时间：还不错其他特色：主要是性价比高，相对ip14来说
j***e,star5,外形外观：外形外观高端大气上档次屏幕音效：屏幕、音效效果好拍照效果：拍照像素好运行速度：运行速度快待机时间：待机时间chan?t其他特色：苹果要比其他手机运行要好得多
茶***孩,star5,外形外观：外观好看，很有质感，现在趁着活动买很优惠屏幕音效：真的超级喜欢，质量非常好，与卖家描述的一致！拍照效果：拍照好看清晰，拍照效果很好，拍照清晰
g***4,star5,手机好看颜值高 果粉 一直想换iphone ，拍照像素最爱了 喜欢拍照 清晰度 苹果是最满意的 百搭手机壳 本人喜欢换手机壳 拿在手里很小巧 舒服 也不重 6.1英寸 反应也特别快，真心不错 ，手感特别快 流畅 拿到后检查没有瑕疵 京东官方旗舰店 可靠 不怕翻车 质量有保障
莔***濛,star5,外形尺寸非常合手，重量感觉比较有质感，暗紫色非常有气质，运行速度超快，显示效果和拍照效果感觉比13pro要好一点，毕竟前主摄像素更高，屏幕边角比13pro更圆一些，灵动岛的效果感觉屏幕完整性更好。整体非常满意!
喃***语,star5,外形外观：喜欢的颜色，可以搭配各种各样的手机壳屏幕音效：很不错！拍照效果：赞赞赞运行速度：觉得很快啊，很嗨待机时间：1天没问题，苹果都是一天一充
蚂***桃,star5,信号很好，音质也不错，背面的镜面设计非常有质感，触感非常舒适。手机的配置非常强大，处理速度也非常快，光线不好的条件下拍照效果也非常棒，支持5G，网速很快，总之 ，我非常喜欢这款苹果手机，强烈推荐给所有的数码控。
阿***钱,star5,给老婆买的，很喜欢，用着也很流畅，128 就够了，京东有保障非常好其他特色：颜色很好看  星空色拍照效果：拍摄效果很好序列号查啦，盒子，手机序列号一致，是官方那个零售机
s***y,star5,手机很不错，运行流畅，图像清晰。对于我这种不打游戏不用手机拍照的人来说128G的容量足够了。目前来看，续航能力也就这样吧，一天一充，电池问题是苹果众所周知的bug。外观、手感都很好！
j***4,star5,这几天京东做活动，对比了13和14，首先13有价格优势，也还是苹果手机，苹果手机更新迭代很快，最终选择苹果13，128g谢谢京东外形外观：外形尺寸复合自己的定位屏幕音效：很丝滑，不伤眼睛拍照效果：有优势运行速度：比安卓手机运行流畅，效果杠杠滴
j***x,star5,外形外观：外形美观大方又不失时尚屏幕音效：屏幕尺寸显示屏幕好拍照效果：拍照技术也太好了运行速度：运行速度快待机时间：待机时间最长达两天
l***s,star5,这款iPhone的外观设计非常漂亮，非常精致。它的金属边框和玻璃背板让它看起来非常高档。我选择了银色版本，它看起来非常干净和时尚。使用：这款iPhone的使用体验非常好。它的操作系统非常直观，易于使用。我喜欢它的触摸屏幕，它反应灵敏，并且显示效果很清晰。
j***U,star5,拍照效果很好，像素也不错。电池续航也还好，每天充一次电管一天。屏幕大小合适，不卡顿。星光色适配各种手机壳，喜欢。
前***年,star5,外形外观:我一直特别喜欢白色，所以对白色没有抵抗力，无敌屏幕音效:音效好棒，看视频，听音乐就是一直享受拍照效果:苹果的拍照还是一如既往的厉害运行速度:流畅，可以用3年。
u***v,star5,该产品外观小巧，握特非常舒适，操作使用极为方便。但如果你是大屏手机爱好者，并且想拥有动感和激选的设计，那么绿色的 ihone13Pro 和ihone 13ProMax 也是不镨的选
j***f,star5,"手机外观很好看，性价比高,用起来来很流畅，拍照很清,运行速度也挺快,非常好用的的手机!屏幕色彩很吸引人,很艳丽，不刺眼，很很柔和!待机时间很长，大电池效果好用起来很舒舒服!充电也很快，很好的手机,推荐购买!京东服务很好送货很快"
品***7,star5,之前的苹果手机有点卡了，买了13，外形特别顺手，屏幕也比之前的11好太多，对手机要求其实不高，只是喜欢苹果系统。拍照很清晰，待机一天吧，推荐！
小***侠,star3,产品在使用中，送货速度快
傅***新,star5,手机非常不错，使用流畅，手感也很好，原先还担心小了，但是6.1寸的屏幕刚刚好！刚开始使用，电池还行，能用大半天，后面建议加大电池容量，这样就更完美了！
j***c,star5,最近做活动，价格比较给力，朋友手机刚好摔坏屏幕了，给他买的金色，我自己用的白色。京东自营还是特别靠谱的，在京东买过好几个苹果手机。这次也没有让我失望，全新未拆封，未激活，拆开检查外观也没有任何划痕，照片视频都是实拍的，希望对有需要的小伙伴有帮助。1外形外观：14promax金色很好看，淡淡的 1屏幕音效：三星屏幕很完美1拍照效果：目前力止苹果手机天花板1运行速度：流畅快 1待机时间：太给力了，一整天毫无压力 1其他特色：此次升级还是挺大的。
巴***撕,star5,外形外观：白色真好看哦低调手感好屏幕音效：屏幕看电影清晰音效很棒拍照效果：拍照片清晰还原度很好运行速度：上网速度快打游戏不卡
d***6,star5,周围朋友都用这款，活动下单，发货非常快。收到很满意。外观大气，颜色高级，干净，很上档次。开机试用了一下，清晰度很高，运行流畅，不卡顿。操作界面我也很喜欢，用着顺手。
j***o,star5,手机很好，原装正品，待机时间长，充电快，不发热，手感不错，系统流畅，屏幕分辨率高，像素也很可，拍照片，录视频都很清晰！！！
u***5,star5,AirPods颜值非常高，沉甸甸的比较有手感，音质音效也比较好，比较舒适，续航能力比较好，发货速度比较快，还会继续支持的，链接速度比较快，非常好。京东618活动力度太大了，比三星s23ultra还便宜了就先买14Promax之前是13Pro，尺寸更大确实好 电池太耐用了 一天都用不完的！拍照这次特别棒123倍均无损 覆盖全面又完美 就是ma超级重哦，特别重！
j***风,star5,用了几天待机不错，一天一夜冲一次电就行了，外观滑溜哈哈耐看，绿色真不错，11的换成了13的，想着至少用4年，比11轻了不少，不累手了，握感也不错，系统运行流畅，这是第三个，我喜欢单数7，11，13，配送很快，送货员更是服务到家，京东自营值得信赖，送货员值得信赖?
叫***巴,star5,外观手感真的很好。不带套子好。屏幕音效：屏幕色彩很鲜艳，运行起来也很流畅。拍照效果跟华为差不多，但摄像还是比较强。运行速度很流畅，一点都不卡顿打游戏。
j***c,star5,到货了，到货了，终于收着我需要的苹果13了，手机很好价美物廉，商家的服务也很热情物流的速度也很给力，第二天就到货了，之前一直想买苹果手机感受活动，在京东上终于下手了。真合适，考虑买的可以下手了，是正品哦。外形外观：很漂亮很漂亮。屏幕音效：分辨率很高音质很好。拍照效果：很清晰运行速度：运行速度很快很快。待机时间：一天其他特色：很好看，很漂亮，很喜欢。喜欢的可以买了，很棒很棒。京东平台也很靠谱。
王***-,star5,手机包装很严谨，屏幕效果：屏幕显示效果很舒服。用的不累眼。运行速度：运行速度很顺畅。不卡壳。机身轻薄，用起来方便。手感很好。
b***6,star5,外形外观：很轻，上手挺舒服的屏幕音效：还不错运行速度：比之前的快很多不知道是不是因为新手机的错觉拍照效果：感觉也就这样，比国产的拍照对比感觉不太行
叫***巴,star5,外观不错，手感很好，不带套子好。屏幕色彩很鲜艳，点哪动哪，使用起来也很流畅。拍照效果不错，摄像还是比较强。运行速度很流畅，打游戏不卡
烟***焰,star5,拿到手机查了序列号，是正品，价格实惠，物流也快，包装好，说说体验吧，用起来很丝滑，一点也不卡顿，大小合适，可以单手操作，手感很好，拍照清晰，而且方法细节也很清晰，是我想要的手机，一直观望这款手机，趁着这做活动，果断下手买了太划算了显示效果：屏幕显示很清醒，看起很舒服！
闹***闹,star5,手机外观好看上档次，很有质感，识别度高，屏幕清晰度很好，运行目前也非常流畅，普通拍照也不错能适应大多数场景，还是挺满意的。
j***q,star5,外形外观：简洁大方，耐看拍照效果：拍照同等价位的算很不错运行速度：iOS运行一直没有让消费者失望。待机时间：待机续航有待提升
老***轳,star5,苹果13手机买了两个了，一个蓝色的，一个红色的，感觉确实不错。很喜欢。手机颜色很好看，各项功能正常。使用起来非常顺手。手机速度很快，没有卡顿现象。
Y***F,star5,货到了 货到了 是全新未激活的 国行正品 考虑的可以下手了 靠谱 靠谱儿 ，京东物流的速度也很快 第二天就到货了 ，一点儿都没有磕碰 又快又稳外形外观：很好看 大小也合适 屏幕音效：屏幕我感觉不错 音效也很棒 拍照效果：很清楚 运行速度：运行速度：很流畅 待机时间：能用小一天 其他特色：很好看一直在京东上买东西 包括日用品 电器 日化都是在京东买 每次都很靠谱考虑的可以下手了
j***3,star5,高端大气上档次太低调奢华有内涵屏幕音效：清晰度高声音洪亮拍照效果：记录真实美好瞬间运行速度：打游戏一点都不卡待机时间：还可以吧其他特色：活动买的，性价比超高
l***6,star5,外形外观造型艺术风格非常好看，屏幕分辨率屏幕很好，音效很好，拍照效果很棒，运行速度很快，待机时间较长，发货速度，到货速度很快，大小合适。
